pub_date	title	venue	excerpt	citation	url_slug	paper_url
2022-03-23	A Semi-Supervised Semantic Segmentation Method for Blast-Hole Detection	Symmetry	This paper is about the number 1. The number 2 is left for future work.	Zhang, Z.; Deng, H.; Liu, Y.; Xu, Q.; Liu, G. A Semi-Supervised Semantic Segmentation Method for Blast-Hole Detection. Symmetry 2022, 14, 653.	paper-title-number-1	https://www.mdpi.com/2073-8994/14/4/653/pdf
2022-04-03	A Fast Circle Detector with Efficient Arc Extraction	Symmetry	This paper is about the number 1. The number 2 is left for future work.	Liu, Y.; Deng, H.; Zhang, Z.; Xu, Q. A Fast Circle Detector with Efficient Arc Extraction. Symmetry 2022, 14, 734.	paper-title-number-1	https://www.mdpi.com/2073-8994/14/4/734/pdf?version=1649224900
2022-07-29	A ConvNext-Based and Feature Enhancement Anchor-Free Siamese Network for Visual Tracking	Electronics	This paper is about the number 1. The number 2 is left for future work.	Xu, Q.; Deng, H.; Zhang, Z.; Liu, Y.; Ruan, X.; Liu, G. A ConvNext-Based and Feature Enhancement Anchor-Free Siamese Network for Visual Tracking. Electronics 2022, 11, 2381.	paper-title-number-1	https://www.mdpi.com/2079-9292/11/15/2381/pdf?version=1659612234
2022-09-25	A Fast Circle Detection Algorithm Based on Information Compression	Sensors	This paper is about the number 1. The number 2 is left for future work.	Ou, Y.; Deng, H.; Liu, Y.; Zhang, Z.; Ruan, X.; Xu, Q.; Peng, C. A Fast Circle Detection Algorithm Based on Information Compression. Sensors 2022, 22, 7267. 	paper-title-number-1	https://www.mdpi.com/1424-8220/22/19/7267/pdf?version=1664345256
2023-03-02	An Anti-Noise Fast Circle Detection Method Using Five-Quadrant Segmentation	Sensors	This paper is about the number 1. The number 2 is left for future work.	Ou, Y.; Deng, H.; Liu, Y.; Zhang, Z.; Lan, X. An Anti-Noise Fast Circle Detection Method Using Five-Quadrant Segmentation. Sensors 2023, 23, 2732.	paper-title-number-1	https://www.mdpi.com/1424-8220/23/5/2732/pdf?version=1677815380